{
  "version": "1.0",
  "task": {
    "imageCategory": "multi-image",
    "effectStyle": "card-stack",
    "durationSeconds": 8,
    "aspectRatio": "16:9",
    "fps": 60
  },
  "assets": [
    {
      "id": "photo-1",
      "path": "examples/demo-photo-1.svg"
    },
    {
      "id": "photo-2",
      "path": "examples/demo-photo-2.svg"
    },
    {
      "id": "photo-3",
      "path": "examples/demo-photo-3.svg"
    },
    {
      "id": "photo-4",
      "path": "examples/demo-photo-4.svg"
    }
  ],
  "text": {
    "title": "Card Stack",
    "subtitle": "Multi-image cards expand into a layered stack."
  },
  "options": {
    "intensity": "medium",
    "background": "gradient",
    "fit": "cover"
  }
}
